Loprin,Aspirin (low dose),C9H8O4,Antiplatelet Agent,"heart attack prevention,stroke prevention,antiplatelet,clot prevention,cardiovascular disease",Prevention of myocardial infarction and stroke. Antiplatelet therapy in cardiovascular disease.,75-150mg once daily,Not used for antiplatelet purposes; Kawasaki disease only under specialist supervision,Contraindicated for antipyretic/anti-inflammatory use,75mg once daily; monitor for GI bleeding,Low-dose may be used in pre-eclampsia under supervision; avoid in 3rd trimester,"GI bleeding, stomach irritation, bruising, tinnitus (overdose)",Take with food or after meals; avoid with other NSAIDs; stop 7-10 days before surgery,"Active peptic ulcer, bleeding disorders, children under 16 for analgesic use","Warfarin, clopidogrel, NSAIDs, heparin",Bayer Pakistan,"Gastro-resistant tablet 75mg, 100mg",Aspirin (generic),"Ecosprin, Disprin CV",OTC / Prescription,adults only,18,False,False,False
Lipitor,Atorvastatin Calcium,C33H35FN2O5·Ca,Antihyperlipidemic (Statin),"high cholesterol,dyslipidemia,cardiovascular disease prevention,high LDL","Primary hypercholesterolemia, mixed dyslipidemia, cardiovascular event prevention, familial hypercholesterolemia.",10-80mg once daily (any time of day),10-20mg once daily (10-17 years with familial hypercholesterolemia),Not recommended,Standard dose; monitor for myopathy,Contraindicated,"Myopathy/myalgia, rhabdomyolysis (rare), elevated liver enzymes, headache, GI upset",Contraindicated in pregnancy; monitor liver function; avoid with certain drugs that increase levels,"Active liver disease, pregnancy, breastfeeding","Cyclosporine, gemfibrozil, niacin, macrolides, amlodipine (max 80mg)",Pfizer Pakistan,"Tablet 10mg, 20mg, 40mg, 80mg",Atorvastatin (generic),"Crestor (rosuvastatin), Zocor (simvastatin)",Prescription,adults and children over 10,10,False,False,True
Crestor,Rosuvastatin Calcium,C22H28FN3O6S·Ca,Antihyperlipidemic (Statin),"high cholesterol,dyslipidemia,high LDL,cardiovascular risk","Hypercholesterolemia, primary prevention of cardiovascular events, mixed dyslipidemia.",5-40mg once daily; max 40mg/day,5-20mg once daily (10-17 years),Not recommended,Start 5mg; Asian patients: start 5mg,Contraindicated,"Myalgia, myopathy, headache, constipation, abdominal pain, proteinuria",Contraindicated in pregnancy; monitor for muscle symptoms; renal monitoring,"Active liver disease, pregnancy, severe renal impairment, myopathy","Cyclosporine (max 5mg), gemfibrozil (avoid), antacids, warfarin",AstraZeneca Pakistan,"Tablet 5mg, 10mg, 20mg, 40mg",Rosuvastatin (generic),"Lipitor, Zocor",Prescription,adults and children over 10,10,False,False,True
Zocor,Simvastatin,C25H38O5,Antihyperlipidemic (Statin),"high cholesterol,dyslipidemia,cardiovascular disease prevention","Hypercholesterolemia, cardiovascular event prevention, type 2 diabetic dyslipidemia.",10-40mg once daily in the evening; max 80mg (restricted),10-40mg once daily (10-17 years),Not recommended,Start 10mg; max 20mg with interacting drugs,Contraindicated,"Myopathy (dose-dependent), elevated liver enzymes, headache, GI upset",80mg dose avoided due to myopathy risk; drug interactions limit dose; contraindicated in pregnancy,"Active liver disease, pregnancy, concomitant strong CYP3A4 inhibitors","Amlodipine (max 20mg simvastatin), amiodarone, cyclosporine, many antibiotics",MSD Pakistan,"Tablet 5mg, 10mg, 20mg, 40mg",Simvastatin (generic),"Lipitor, Crestor",Prescription,adults and children over 10,10,False,False,True
Surbex-Z,Multivitamin + Zinc (B-complex with Vitamin C and Zinc),Complex vitamin-mineral formulation,Vitamin / Mineral Supplement,"vitamin deficiency,zinc deficiency,fatigue,weakness,poor wound healing,immune support","Prevention and treatment of vitamin B-complex and zinc deficiencies, general nutrition support, post-illness recovery.",1 tablet twice daily,1 tablet once daily (consult physician),Not recommended,1-2 tablets daily,Use as directed by physician; folic acid may be insufficient for pregnancy needs,"Nausea (with zinc), yellow discoloration of urine (riboflavin), GI upset",May cause yellow urine (normal); take after food to reduce GI discomfort; zinc can interfere with copper absorption long-term,Hypervitaminosis,"Zinc reduces absorption of quinolones, tetracyclines",Abbott Laboratories Pakistan,Film-coated tablet,B-complex + Zinc multivitamins,"Neurobion, Centrum, Theragran Ultra",OTC,adults and children over 5,5,True,True,False
Neurobion,Vitamins B1 + B6 + B12,C12H17ClN4OS + C8H11NO3 + C63H88CoN14O14P,Vitamin B-complex supplement,"neuropathy,nerve pain,vitamin B deficiency,numbness,tingling,diabetic neuropathy,fatigue","Peripheral neuropathy, diabetic neuropathy, vitamin B1/B6/B12 deficiency, nerve regeneration support.",1 tablet 1-3 times daily or 1 ampoule IM/IV injection,Consult physician,Not recommended,1-2 tablets daily,Safe in normal doses,"Peripheral neuropathy from excess B6 (high doses), injection site pain, allergic reactions",Excess B6 (>200mg/day) causes sensory neuropathy; injection form for severe deficiency,Hypersensitivity; avoid high-dose B6 long-term,"Levodopa (B6 reduces efficacy unless combined with carbidopa), isoniazid",Merck Pakistan,Tablet; Forte tablet; Ampoule injection,Vitamin B1+B6+B12 (generic),"Surbex-Z, Methycobal, Vitabion",OTC,adults and children,0,True,True,False
Methycobal,Methylcobalamin (Vitamin B12),C63H91CoN13O14P,Vitamin B12 supplement,"vitamin B12 deficiency,neuropathy,anemia,numbness,tingling,fatigue,megaloblastic anemia","Peripheral neuropathy, vitamin B12 deficiency, megaloblastic anemia, diabetic neuropathy.",500mcg 3 times/day orally; injection 500mcg IM 3 times/week,As directed by physician,As directed,Standard dose,Safe; often prescribed,"Rare: mild GI discomfort, injection site pain",Different from cyanocobalamin; better absorbed; preferred in neuropathy,Hypersensitivity to cobalamin,"Metformin, PPIs, H2-blockers reduce B12 absorption",Eisai Pakistan / Various,Tablet 500mcg; Injection 500mcg/ml,Methylcobalamin (generic),"Neurobion, Vitabion",OTC / Prescription,all ages,0,True,True,False
CAC-1000 Plus,Calcium + Vitamin C + Vitamin D3,CaCO3 + C6H8O6 + C27H44O,Calcium + Vitamin Supplement,"calcium deficiency,bone weakness,osteoporosis,vitamin C deficiency,immune weakness,muscle cramps","Calcium and Vitamin C deficiency, osteoporosis prevention, immune support, muscle cramp prevention.",1 effervescent tablet dissolved in water once or twice daily,1 tablet daily (5+ years),Not recommended,1-2 tablets daily for osteoporosis prevention,Safe; recommended,"GI discomfort, constipation, nausea",Hypercalcemia risk with excessive intake; avoid with tetracyclines,"Hypercalcemia, kidney stones","Tetracyclines, fluoroquinolones, iron (reduces absorption if taken together)",Searle Pakistan,Effervescent tablet,Calcium + Vitamin C supplements,"Caltrate, Centrum, Oscal",OTC,adults and children over 5,5,True,True,False
Centrum,Multivitamin + Multimineral,Complex formulation,Multivitamin / Mineral Supplement,"nutritional deficiency,fatigue,immune weakness,general health maintenance","General nutritional supplementation, prevention of vitamin and mineral deficiencies, immune support.",1 tablet daily with food,Children's Centrum 1 tablet daily,Not recommended,Centrum Silver formulation preferred,Centrum Materna recommended for pregnancy,"Nausea (if taken on empty stomach), yellow urine (B vitamins), constipation (iron)",Take with food; iron-containing formulas can cause constipation; avoid in hemochromatosis,"Hemochromatosis, hypervitaminosis A or D","Iron reduces absorption of quinolones, tetracyclines",Haleon / Pfizer Pakistan,Tablet; Silver (elderly) tablet; Materna (pregnancy) tablet,Generic multivitamins,"Theragran Ultra, Surbex-Z",OTC,all ages,2,True,True,False
Caltrate,Calcium Carbonate + Vitamin D3,CaCO3 + C27H44O,Calcium + Vitamin D Supplement,"osteoporosis,calcium deficiency,vitamin D deficiency,bone pain,fracture risk","Osteoporosis prevention and treatment, calcium and vitamin D deficiency, post-menopausal bone health.",1-2 tablets twice daily with food,Consult physician,Not recommended,1 tablet twice daily; essential for osteoporosis,Safe and recommended,"Constipation, flatulence, hypercalcemia (excess), kidney stones",Take with meals; avoid in hypercalcemia; limit dose in renal impairment,"Hypercalcemia, kidney stones, severe renal impairment","Tetracyclines, iron, bisphosphonates (space by 2 hours)",Pfizer Pakistan,Tablet 600mg calcium + 400IU D3; Plus formulations,Calcium Carbonate + Vitamin D3 (generic),"CAC-1000 Plus, Oscal, Ostocalcium",OTC,adults and elderly,12,True,True,False
Evion,Vitamin E (alpha-Tocopherol Acetate),C31H52O3,Vitamin E Supplement / Antioxidant,"vitamin E deficiency,skin health,antioxidant,muscle weakness,neuropathy","Vitamin E deficiency, antioxidant support, skin health, male and female fertility support, intermittent claudication.",400 IU once daily; deficiency: up to 1000 IU/day,As per physician recommendation,As per physician,400 IU daily,Safe in normal doses (400 IU); avoid megadoses,"Nausea, diarrhea, bleeding (very high doses), fatigue",Megadoses increase bleeding risk; avoid with anticoagulants at high doses,"Hypervitaminosis E, active bleeding","Warfarin (increased bleeding at high doses), vitamin K",Merck Pakistan,"Capsule 200mg (200 IU), 400mg (400 IU); Cream",Vitamin E (generic tocopherol),"E-nat, Vitaneed E",OTC,all ages,0,True,True,False
Theragran Ultra,Multivitamin + Multimineral (comprehensive),Complex formulation,Multivitamin / Mineral Supplement,"nutritional deficiency,fatigue,immune weakness,vitamin deficiency,mineral deficiency",Comprehensive nutritional supplement for prevention of multiple vitamin and mineral deficiencies.,1 tablet daily,Not recommended (adult formulation),Not recommended,1 tablet daily,Physician consultation required,"Nausea, yellow urine, GI discomfort, constipation",Take with food; avoid in hemochromatosis; not a replacement for specific deficiency treatment,"Hemochromatosis, hypervitaminosis","Iron interacts with tetracyclines, quinolones",Squibb / BMS Pakistan,Tablet,Generic multivitamins,"Centrum, Surbex-Z",OTC,adults only,12,False,False,False
Vitamin D3 Sachet,Cholecalciferol (Vitamin D3),C27H44O,Vitamin D Supplement,"vitamin D deficiency,rickets,osteomalacia,bone pain,muscle weakness,immune weakness,fatigue","Vitamin D deficiency, rickets in children, osteomalacia, osteoporosis prevention, immune modulation.","1000-2000 IU daily (maintenance); 50,000 IU weekly for 8 weeks (deficiency treatment)",400-1000 IU daily (maintenance); treat deficiency per protocol,400 IU daily (prevention); consult physician for deficiency,1000-2000 IU daily; higher if serum 25-OHD very low,1000-2000 IU daily; consult physician,"Hypercalcemia (excess), constipation, nausea, kidney stones",Monitor serum 25-OHD levels; excessive supplementation causes toxicity; dissolve in water/milk,"Hypercalcemia, hypervitaminosis D, sarcoidosis","Thiazide diuretics (hypercalcemia risk), digoxin","Various Pakistan (Hilton Pharma, Sami, Getz)","Sachet 600IU, 1000IU, 2000IU, 50000IU; Drops; Capsule",Cholecalciferol (generic),"Vigantol, D-vite, Calcirol",OTC / Prescription (high dose),all ages,0,True,True,False
Polyfax,Polymyxin B + Bacitracin,Polypeptide antibiotics,Topical Antibiotic,"skin infection,wound infection,cuts,abrasions,burns,impetigo,infected eczema","Prevention and treatment of bacterial skin infections, infected wounds, cuts, burns, abrasions.",Apply thin layer to affected area 1-4 times daily,Apply thin layer to affected area 2-3 times daily,Apply sparingly under physician supervision,Standard topical application,Safe for topical use,"Contact dermatitis, local skin irritation, allergic reaction",For external use only; avoid in large wounds or prolonged use (systemic absorption risk with polymyxin B); avoid in ears if perforated eardrum,Known allergy to polymyxin or bacitracin,Minimal with topical use,GSK Pakistan,"Ointment 15g, 30g",Polymyxin B + Bacitracin (generic),"Fucidin, Neosporin, Bactroban",OTC,all ages,0,True,True,False
Fucidin,Fusidic Acid,C31H48O6,Topical Antibiotic,"skin infection,impetigo,infected eczema,folliculitis,wound infection","Staphylococcal skin infections, impetigo, infected eczema, folliculitis, infected wounds.",Apply to affected area 3-4 times daily for up to 10-14 days,Apply 2-3 times daily,Apply sparingly under physician supervision,Standard topical,Safe for limited topical use,"Local irritation, contact dermatitis, burning sensation",Avoid prolonged use to prevent resistance; avoid near eyes; for external use only,Fusidic acid hypersensitivity,Minimal with topical use,Leo Pharma Pakistan,Cream 2%; Ointment 2%; Gel (sodium fusidate),Fusidic acid (generic),"Polyfax, Bactroban",Prescription,all ages,0,True,True,True
Betnovate,Betamethasone Valerate,C27H37FO6,Topical Corticosteroid (potent),"eczema,psoriasis,dermatitis,skin inflammation,itching,allergic skin reactions","Inflammatory and pruritic skin conditions including eczema, psoriasis, contact dermatitis, seborrheic dermatitis.",Apply thin layer 1-2 times daily; max 2 weeks on face,Apply sparingly once daily; limit to 5-7 days on face,Not recommended except under specialist supervision,Standard topical; limit duration,Avoid extensive use; limited to small area short-term,"Skin thinning, striae, telangiectasia, acne, hypertrichosis (prolonged use), systemic effects with extensive use",Do not use on face for long term; avoid on infected skin; taper dose; not for nappy area in children,"Rosacea, acne, perioral dermatitis, fungal infections, viral skin infections",Minimal topically,GSK Pakistan,Cream 0.1%; Ointment 0.1%; Lotion 0.1%; Scalp application,Betamethasone valerate (generic),"Celestoderm, Diprosone",Prescription,adults and children over 2,2,False,False,True
Skinoren,Azelaic Acid,C9H16O4,Topical Acne Treatment / Dermatological,"acne,rosacea,hyperpigmentation,comedones,inflammatory acne","Acne vulgaris, rosacea, post-inflammatory hyperpigmentation, mild to moderate inflammatory acne.",Apply thin layer to affected area twice daily (morning and evening),Not routinely used under 12,Not recommended,Standard application,Category B; safe in 2nd and 3rd trimester; consult physician,"Tingling, burning, stinging on application, skin dryness, itching",Avoid eyes and mouth; use sunscreen; may cause temporary lightening of dark skin,Azelaic acid hypersensitivity,None significant topically,Bayer Pakistan,Cream 20%; Gel 15%,Azelaic acid (generic),"Finacea, Acneze",Prescription,adults and adolescents over 12,12,True,True,True
Kenacomb,Triamcinolone + Neomycin + Gramicidin + Nystatin,Complex combination,Topical combination (Corticosteroid + Antibiotic + Antifungal),"infected eczema,mixed skin infection,skin inflammation with bacterial or fungal infection","Inflammatory skin conditions with bacterial or fungal secondary infection, infected eczema, intertrigo.",Apply thin layer 2-4 times daily,Apply sparingly 2 times daily,Avoid or use under strict physician supervision,Standard topical; limit duration,Avoid extensive or prolonged use,"Skin thinning (steroid), sensitization to neomycin, systemic absorption with extensive use",Avoid prolonged use; avoid on face; neomycin sensitization risk; not for viral or primary fungal infections alone,"Tuberculosis of skin, herpes simplex, varicella, neomycin hypersensitivity",Minimal topically,Squibb Pakistan,Cream; Ointment; Ear/Eye drops,Triamcinolone + Neomycin + Nystatin (generic),"Quadriderm, Dermovate combination",Prescription,adults and children over 2,2,False,False,True
Quadriderm,Betamethasone + Gentamicin + Tolnaftate + Clioquinol,Complex combination,Topical combination (Corticosteroid + Antibacterial + Antifungal),"mixed skin infection,tinea,fungal infection with inflammation,infected eczema","Inflammatory dermatoses with concurrent bacterial and fungal infection, tinea infections with secondary inflammation.",Apply thin layer to affected area 2-3 times daily,Apply sparingly once or twice daily,Avoid or use under strict supervision,Limit duration; monitor for systemic effects,Avoid,"Skin thinning, acne, striae, gentamicin sensitization, skin discoloration (clioquinol)",Short-term use only; avoid on face; clioquinol may stain clothing and skin,"Viral skin diseases, tuberculosis of skin, known hypersensitivity to components",Minimal topically,Schering-Plough / MSD Pakistan,Cream; Ointment,Betamethasone + Gentamicin + Antifungal (generic),"Kenacomb, Daktacort",Prescription,adults and children over 2,2,False,False,True
Xanax,Alprazolam,C17H13ClN4,Anxiolytic (Benzodiazepine),"anxiety,panic disorder,generalized anxiety disorder,social anxiety,phobia","Generalized anxiety disorder (GAD), panic disorder, social anxiety disorder. Short-term treatment only.",0.25-0.5mg 3 times/day; panic disorder: up to 10mg/day in divided doses,Not recommended,Contraindicated,0.25mg 2-3 times/day; high risk of falls and confusion,Avoid; causes neonatal withdrawal and cleft palate risk,"Sedation, drowsiness, impaired coordination, dependence, withdrawal syndrome, memory impairment",High dependence potential; short-term use only; taper slowly to stop; avoid alcohol; impairs driving,"Acute narrow-angle glaucoma, severe respiratory depression, myasthenia gravis, pregnancy","Alcohol, opioids, other CNS depressants, ketoconazole, CYP3A4 inhibitors",Pfizer Pakistan,"Tablet 0.25mg, 0.5mg, 1mg, 2mg; XR 0.5mg, 1mg, 2mg, 3mg",Alprazolam (generic),"Lexotanil (bromazepam), Librium (chlordiazepoxide)",Prescription (controlled),adults only,18,False,False,True
Lexotanil,Bromazepam,C14H10BrN3O,Anxiolytic (Benzodiazepine),"anxiety,tension,insomnia,generalized anxiety disorder","Anxiety, tension, and agitation. Short-term treatment of anxiety disorders.",1.5-3mg 2-3 times/day; max 18mg/day,Not recommended,Contraindicated,Start 1.5mg; high risk of falls,Avoid,"Sedation, drowsiness, ataxia, dependence, withdrawal",Dependence risk; short-term use; avoid alcohol and driving; do not stop abruptly,"Myasthenia gravis, sleep apnea, severe hepatic impairment, pregnancy","Alcohol, CNS depressants, anticonvulsants",Roche Pakistan,"Tablet 1.5mg, 3mg, 6mg",Bromazepam (generic),"Xanax, Ativan",Prescription (controlled),adults only,18,False,False,True
Prozac,Fluoxetine HCl,C17H18F3NO·HCl,Antidepressant (SSRI),"depression,OCD,panic disorder,bulimia,PMDD,anxiety","Major depressive disorder, OCD, panic disorder, bulimia nervosa, PMDD, social anxiety disorder.",20mg once daily (morning); max 80mg/day; increase after 4 weeks if needed,10-20mg once daily (8+ years for depression/OCD),Not recommended,10-20mg once daily; longer half-life means slower titration,Category C; risks vs benefits; neonatal withdrawal possible,"Nausea, insomnia, anxiety, sexual dysfunction, weight changes, serotonin syndrome (rare), suicidal ideation in youth",Monitor for suicidal thoughts in young adults; allow 4-6 weeks for effect; long washout period; avoid MAOIs,"MAOI use within 14 days, pimozide, thioridazine","MAOIs (serotonin syndrome), tramadol, triptans, lithium, warfarin, pimozide",Eli Lilly Pakistan,"Capsule/Tablet 10mg, 20mg, 40mg; Liquid 20mg/5ml",Fluoxetine (generic),"Zoloft (sertraline), Cipralex (escitalopram)",Prescription,adults and children over 8,8,False,False,True
Zoloft,Sertraline HCl,C17H17Cl2N·HCl,Antidepressant (SSRI),"depression,OCD,PTSD,panic disorder,social anxiety,PMDD","Major depression, OCD, PTSD, panic disorder, social anxiety disorder, PMDD.",50mg once daily; increase to 200mg/day if needed,25mg once daily (6-12 years for OCD); increase slowly,Not recommended,25-50mg; titrate slowly; hepatic dose adjustment,Category C; neonatal adaptation syndrome possible,"Nausea, diarrhea, sexual dysfunction, insomnia, dry mouth, sweating",Monitor suicidality in young adults; 4-6 weeks for full effect; do not stop abruptly,"MAOIs within 14 days, pimozide","MAOIs, tramadol, warfarin, pimozide, lithium",Pfizer Pakistan,"Tablet 25mg, 50mg, 100mg; Oral concentrate",Sertraline (generic),"Prozac, Cipralex",Prescription,adults and children over 6,6,False,False,True
Cipralex,Escitalopram Oxalate,C20H21FN2O·C2H2O4,Antidepressant (SSRI),"depression,generalized anxiety disorder,panic disorder,OCD,social anxiety","Major depression, GAD, panic disorder, OCD, social anxiety disorder.",10mg once daily; increase to 20mg if needed,Not recommended (12-17 years: under specialist only),Not recommended,5-10mg once daily (hepatic dose),Category C; PPHN risk with late pregnancy use,"Nausea, headache, insomnia, sexual dysfunction, sweating, QT prolongation",QT prolongation at higher doses; monitor in elderly; suicidality in youth warning,"MAOIs within 14 days, QT prolongation, citalopram combined","MAOIs, tramadol, pimozide, QT-prolonging drugs, metoprolol",Lundbeck Pakistan,"Tablet 5mg, 10mg, 20mg",Escitalopram (generic),"Zoloft, Prozac, Lexapro",Prescription,adults only,18,False,False,True
Neuromet,Pregabalin,C8H17NO2,Anticonvulsant / Neuropathic Pain Agent,"neuropathic pain,diabetic neuropathy,postherpetic neuralgia,fibromyalgia,epilepsy,anxiety","Neuropathic pain (diabetic, PHN), fibromyalgia, adjunct therapy for epilepsy, GAD (off-label in Pakistan).",75-150mg twice daily; max 600mg/day,Not established,Not recommended,Renal dose adjustment; start low,Category C; avoid,"Dizziness, somnolence, weight gain, blurred vision, edema, euphoria (abuse potential)",Do not stop abruptly; renal dose adjustment; abuse potential; suicidality risk; avoid driving,Hypersensitivity,"Opioids (CNS depression), alcohol, lorazepam, thiazolidinediones",Getz Pharma Pakistan,"Capsule 25mg, 50mg, 75mg, 100mg, 150mg, 200mg, 300mg",Pregabalin (generic),"Lyrica, Pregalin",Prescription (controlled),adults only,18,False,False,True
Tegretol,Carbamazepine,C15H12N2O,Anticonvulsant / Mood Stabilizer,"epilepsy,seizures,trigeminal neuralgia,bipolar disorder,neuropathic pain","Epilepsy (partial and generalized tonic-clonic), trigeminal neuralgia, bipolar disorder, neuropathic pain.",200mg twice daily initially; increase to 800-1200mg/day; therapeutic monitoring required,10-20mg/kg/day in divided doses,Consult neurologist,Start low; increased risk of SIADH and cardiac conduction effects,Category D; teratogenic (spina bifida); use only if essential,"Dizziness, diplopia, drowsiness, ataxia, hyponatremia, Stevens-Johnson syndrome (HLA-B*1502 carriers), agranulocytosis",Genetic testing for HLA-B*1502 in Asian patients; monitor CBC and sodium; many drug interactions,"Bone marrow suppression, MAOIs, tricyclic antidepressants, AV heart block","Many CYP450 interactions — macrolides, azoles, valproate, phenytoin, warfarin, OCP",Novartis Pakistan,"Tablet 100mg, 200mg, 400mg; CR tablet; Suspension 100mg/5ml",Carbamazepine (generic),"Carbatol, Mazetol",Prescription,all ages,0,False,False,True
Neurontin,Gabapentin,C9H17NO2,Anticonvulsant / Neuropathic Pain Agent,"neuropathic pain,epilepsy,postherpetic neuralgia,diabetic neuropathy,restless leg syndrome","Epilepsy (adjunct), postherpetic neuralgia, diabetic neuropathy, restless legs syndrome.",300mg on day 1; 300mg twice daily day 2; 300mg 3 times daily day 3; titrate to 1800-3600mg/day,10-15mg/kg/day in 3 divided doses (3+ years),Not established,Renal dose adjustment; start low,Category C; avoid,"Dizziness, somnolence, ataxia, fatigue, weight gain, peripheral edema",Do not stop abruptly; renal dose adjustment; abuse potential; suicidality warning,Hypersensitivity,"Antacids reduce absorption, opioids, alcohol, CNS depressants",Pfizer Pakistan,"Capsule 100mg, 300mg, 400mg; Tablet 600mg, 800mg; Solution",Gabapentin (generic),"Neuromet (pregabalin), Gabapin",Prescription,adults and children over 3,3,False,False,True
Depakine,Sodium Valproate / Valproic Acid,C8H16O2·Na,Anticonvulsant / Mood Stabilizer,"epilepsy,seizures,bipolar disorder,migraine prevention","All types of epilepsy, bipolar disorder (mood stabilizer), migraine prophylaxis.",600-2400mg/day in 2-3 divided doses; serum monitoring required,Initially 15-20mg/kg/day; maintenance 20-30mg/kg/day,High risk of fatal hepatotoxicity; avoid if possible,Reduce dose; hepatic caution,"Category X / highest teratogenic risk; avoid absolutely if possible (neural tube, autism, cognitive defects)","Weight gain, tremor, hair loss, GI upset, hepatotoxicity, pancreatitis, thrombocytopenia",Teratogenic — highly dangerous in pregnancy; monitor liver function and CBC; drug interactions via enzyme inhibition,"Pregnancy (unless absolutely necessary), hepatic disease, mitochondrial disease, personal/family history of hepatic porphyria","Carbamazepine, phenytoin, lamotrigine, aspirin, warfarin",Sanofi Pakistan,"Tablet 200mg, 500mg; Chrono tablet 300mg, 500mg; Syrup 200mg/5ml; IV",Valproate (generic),"Epilim, Valparin",Prescription,adults and children over 2 (avoid under 2),2,False,False,True
