Euthyrox,Levothyroxine Sodium,C15H10I4NNaO4,Thyroid Hormone Replacement,"hypothyroidism,myxedema,goiter,thyroid cancer (post-surgery),fatigue,weight gain,cold intolerance","Hypothyroidism, myxedema coma, thyroid cancer (as suppression therapy), non-toxic goiter.",Start 25-50mcg/day; increase by 25mcg every 4-6 weeks; usual maintenance 100-200mcg/day,2-4mcg/kg/day; neonates: 10-15mcg/kg/day,10-15mcg/kg/day (neonatal hypothyroidism critical to treat early),Start 12.5-25mcg; titrate slowly; cardiac monitoring,Dose often needs to increase; TSH monitoring every trimester; safe and essential in pregnancy,"Overdose: palpitations, angina, arrhythmia, tremor, weight loss, heat intolerance, insomnia",Take 30-60 min before breakfast on empty stomach; avoid with calcium/iron by 4 hours; monitor TSH 6-8 weeks after dose change,"Untreated adrenal insufficiency, uncorrected thyrotoxicosis","Calcium, iron, antacids (reduce absorption), warfarin, amiodarone, phenytoin",Merck Pakistan,"Tablet 25mcg, 50mcg, 75mcg, 88mcg, 100mcg, 125mcg, 150mcg, 200mcg",Levothyroxine (generic),"Thyroxine (generic), Synthroid, Levothroid",Prescription,all ages,0,True,True,True
Thyroxine,Levothyroxine Sodium,C15H10I4NNaO4,Thyroid Hormone Replacement,"hypothyroidism,fatigue,weight gain,cold intolerance,myxedema",Hypothyroidism replacement therapy. Generic equivalent of Euthyrox.,25-200mcg once daily before breakfast,2-4mcg/kg/day,10-15mcg/kg/day (neonates),Start low; titrate slowly,Essential; increase dose monitoring,"Signs of thyrotoxicosis if overdosed: palpitations, tremor, sweating",Take on empty stomach; space from interfering drugs; monitor TSH,"Thyrotoxicosis, uncorrected adrenal insufficiency","Calcium, iron, antacids, warfarin",Various Pakistan,"Tablet 50mcg, 100mcg",Levothyroxine (generic),"Euthyrox, Synthroid",Prescription,all ages,0,True,True,True
Duphaston,Dydrogesterone,C21H28O2,Progestogen / Hormone,"threatened miscarriage,recurrent miscarriage,dysmenorrhea,endometriosis,irregular periods,PMS","Threatened and habitual miscarriage, dysmenorrhea, endometriosis, premenstrual syndrome, secondary amenorrhea, irregular menstruation.",Threatened miscarriage: 40mg then 10mg every 8 hours; dysmenorrhea: 10mg twice daily days 5-25,Not applicable (female reproductive health),Not applicable,Rarely used,First-line progestogen for threatened miscarriage; safe in pregnancy,"Nausea, headache, breast tenderness, breakthrough bleeding",Not a contraceptive; not an androgenic progestogen (better tolerated); monitor for depression,"Undiagnosed vaginal bleeding, liver tumors, sex hormone-dependent malignancy","Enzyme inducers (phenytoin, rifampicin) reduce efficacy",Abbott Laboratories Pakistan,Tablet 10mg,Dydrogesterone (generic),"Utrogestan (progesterone), Primolut-N (norethisterone)",Prescription,adult females only,16,True,False,True
Primolut-N,Norethisterone (Norethindrone),C20H26O2,Progestogen / Hormone,"abnormal uterine bleeding,dysmenorrhea,endometriosis,delayed menstruation,premenstrual syndrome","Dysfunctional uterine bleeding, dysmenorrhea, endometriosis, postponement of menstruation, contraception (mini-pill).",Dysmenorrhea: 5mg 3 times/day from days 5-24; postpone menstruation: 5mg 3 times/day starting 3 days before expected period,Not applicable,Not applicable,Not typically used,Avoid in 1st trimester; may cause virilization of female fetus,"Nausea, weight gain, bloating, breakthrough bleeding, mood changes, acne",Not for use in 1st trimester; mild androgenic effect; thrombosis risk in high doses,"Pregnancy (1st trimester), thrombosis history, liver disease, undiagnosed vaginal bleeding","Enzyme inducers (rifampicin, phenytoin)",Bayer Pakistan,Tablet 5mg,Norethisterone (generic),"Duphaston, Utrogestan",Prescription,adult females only,16,False,False,True
Cytotec,Misoprostol,C22H38O5,Prostaglandin E1 analog / Gastric mucosal protectant,"peptic ulcer,NSAID-induced ulcer,gastric protection,cervical ripening (medical use only)","Prevention and treatment of NSAID-induced gastric ulcers, gastric protection; also used in obstetrics for cervical ripening and labor induction (medical settings only).",Ulcer prevention: 200mcg with each NSAID dose (4 times/day); gastric: 400-800mcg/day,Not established for GI use,Not recommended,Standard GI dose,CONTRAINDICATED for GI use (causes abortion); ONLY used under medical supervision for obstetric indications,"Diarrhea, abdominal cramps, nausea, shivering, fever",Strictly contraindicated in pregnancy for GI use; teratogenic; regulated controlled substance,"Pregnancy (for GI use), allergy to prostaglandins","Antacids (magnesium-containing worsen diarrhea), oxytocin",Pfizer Pakistan,Tablet 200mcg,Misoprostol (generic),No direct OTC substitute for its GI use,Prescription (highly regulated),adults only (under medical supervision),18,False,False,True
Buscopan,Hyoscine Butylbromide (Scopolamine Butylbromide),C21H30BrNO4,Antispasmodic (Anticholinergic),"abdominal cramps,IBS,stomach spasm,ureteral colic,biliary colic,intestinal spasm,menstrual cramps","Abdominal, biliary, and renal colic; irritable bowel syndrome (IBS); menstrual cramps; intestinal spasm.",20mg (2 tablets) up to 4 times/day; IV/IM: 20mg every 30 minutes (max 100mg/day),10mg (1 tablet) 3 times/day,Not recommended orally; consult physician,Standard dose; caution in urinary retention and glaucoma,Avoid in 1st trimester; used in later stages for labor under supervision,"Dry mouth, tachycardia, urinary retention, blurred vision, constipation","Avoid in glaucoma, urinary retention, myasthenia gravis; does not cross blood-brain barrier","Glaucoma, urinary retention, myasthenia gravis, paralytic ileus","Anticholinergics (additive), amantadine, antihistamines",Sanofi Pakistan,Tablet 10mg; Injection 20mg/ml; Drops,Hyoscine butylbromide (generic),"Colofac, Mebeverine",OTC (tablet) / Prescription (injection),adults and children over 6,6,False,False,False
Imodium,Loperamide HCl,C29H33ClN2O2·HCl,Antidiarrheal,"diarrhea,traveler diarrhea,IBS diarrhea,acute diarrhea,chronic diarrhea","Acute non-specific diarrhea, traveler's diarrhea, diarrhea-predominant IBS.","4mg initially, then 2mg after each loose stool; max 16mg/day","1mg 3 times/day (2-5 years, max 3 days); 2mg 3 times/day (6-8 years); 2mg 4 times/day (9-11 years)",Contraindicated,Standard dose,Category B; use with caution,"Constipation, nausea, abdominal cramps, dizziness, dry mouth",Do not use in infectious diarrhea with fever/blood; avoid in children under 2; stop if no improvement in 48 hours,"Infectious diarrhea (fever/blood), children under 2, acute ulcerative colitis, C. difficile","Saquinavir, ritonavir, quinidine (increase loperamide plasma levels)",Janssen Pakistan,Capsule 2mg; Tablet 2mg; Syrup 1mg/5ml,Loperamide (generic),"Loparol, Lomodex",OTC,adults and children over 2,2,True,False,False
Dulcolax,Bisacodyl,C22H19NO4,Stimulant Laxative,"constipation,bowel preparation,chronic constipation","Constipation, bowel preparation before procedures, post-operative constipation.",5-10mg tablet at night; suppository: 10mg,5mg tablet at night (4+ years); suppository 5mg (under 10 years),Suppository only under physician supervision,5mg; avoid dependence,Avoid; stimulant laxatives not preferred; use bulk-forming agents,"Abdominal cramps, diarrhea, hypokalemia (prolonged use), nausea",Do not take within 1 hour of antacids or milk; not for long-term use; may cause electrolyte imbalance,"Intestinal obstruction, acute abdominal conditions, inflammatory bowel disease","Diuretics, antacids, milk (reduce enteric coating effectiveness)",Sanofi Pakistan,"Enteric-coated tablet 5mg; Suppository 10mg, 5mg; Drops",Bisacodyl (generic),"Laxoberon, Fleet",OTC,adults and children over 4,4,False,False,False
ORS,Oral Rehydration Salts (WHO formula),NaCl + KCl + Na citrate + Glucose (WHO low-osmolarity formula),Rehydration Agent,"dehydration,diarrhea,vomiting,gastroenteritis,cholera,heat exhaustion","Prevention and treatment of dehydration due to diarrhea, vomiting, cholera, heat exhaustion.",200-400ml after each loose stool; total 2-4 liters/day as needed,50-100ml/kg over 2-4 hours for mild-moderate dehydration; 200ml after each loose stool,50-100ml/kg over 4 hours (WHO protocol); give with spoon or syringe,Encourage as tolerated; monitor for hypernatremia,Safe and recommended,"Nausea (if taken too fast), hypernatremia (if ORS made incorrectly)",Prepare correctly with safe water; do not add sugar; seek medical help for severe dehydration,"Severe dehydration (requires IV), ileus",None,Various Pakistan (WHO-certified formulations),Sachets (dissolve in 1 liter water); Ready-to-drink solution,ORS (WHO formula generic),"Pedialyte, Electral",OTC,all ages,0,True,True,False
Ansaid,Flurbiprofen,C15H13FO2,NSAID / Analgesic / Anti-inflammatory,"arthritis,joint pain,inflammation,pain,menstrual cramps,postoperative pain","Rheumatoid arthritis, osteoarthritis, pain relief, dysmenorrhea.",200-300mg/day in 2-4 divided doses; max 300mg/day,Not established,Not recommended,Start low dose; renal monitoring,Avoid; especially 3rd trimester,"GI upset, nausea, headache, dizziness, edema",Take with food; GI risk; avoid in peptic ulcer; cardiovascular risk,"Active peptic ulcer, severe renal/hepatic impairment, 3rd trimester pregnancy","Warfarin, lithium, methotrexate, antihypertensives",Pharmacia (Pfizer) Pakistan,"Tablet 50mg, 100mg; Eye drops (ophthalmic use)",Flurbiprofen (generic),"Brufen, Dicloran, Ponstan",Prescription,adults only,18,False,False,True
